{
  "package_kind": "content",
  "package_id": "atk.content.cost-per-successful-task",
  "schema_version": "0.1.0",
  "version": "0.1.0",
  "status": "draft",
  "title": "每個成功任務到底花多少：在算出答案之前，先確認你的計量器沒有騙你",
  "desk": "token",
  "format": "EXPLAINED",
  "reader_decision": "決定要不要相信手上那張成本報表；以及在導入任何節省工具之前，先驗計量器還是先比價格。",
  "created_at": "2026-09-16",
  "published_at": null,
  "valid_until": "2027-03-16",
  "authorship": {
    "authored_by": [
      "AM22"
    ],
    "reviewed_by": [
      "AM36",
      "AM04"
    ],
    "human_responsible": null,
    "ai_authored": true
  },
  "sources": [
    {
      "source_id": "SRC-E026",
      "source_uri": "ledgers/EVIDENCE_LEDGER.md E026 @ a8ca352dc64e792864f351f7775e2b21681b6390",
      "source_type": "repository_file",
      "source_version": "a8ca352dc64e792864f351f7775e2b21681b6390",
      "retrieved_at": "2026-09-16",
      "retrieval_mode": "verbatim",
      "quote": "12 of the 15 rates in `PS-2026-09-15` carry no cached input rate — every OpenAI and every Anthropic model.",
      "rights_note": "本 repo 自有檔案。"
    },
    {
      "source_id": "SRC-CAL",
      "source_uri": "reports/LAB_001_PILOT_READINESS_REVIEW.md §5 @ a8ca352dc64e792864f351f7775e2b21681b6390",
      "source_type": "repository_file",
      "source_version": "a8ca352dc64e792864f351f7775e2b21681b6390",
      "retrieved_at": "2026-09-16",
      "retrieval_mode": "verbatim",
      "quote": "a meter recording only the accepted call undercounts CAL-002 by 65%; one pricing cached tokens at the uncached rate overstates CAL-003 by 5.41x.",
      "rights_note": "本 repo 自有檔案。"
    },
    {
      "source_id": "SRC-BYTES4",
      "source_uri": "reports/LAB_001_PILOT_READINESS_REVIEW.md §5 @ a8ca352dc64e792864f351f7775e2b21681b6390",
      "source_type": "repository_file",
      "source_version": "a8ca352dc64e792864f351f7775e2b21681b6390",
      "retrieved_at": "2026-09-16",
      "retrieval_mode": "verbatim",
      "quote": "the prohibited `bytes/4` estimator's error ranges from 13.6% to 61.0% across content types on the fixture, and changes sign. No calibration factor fixes an estimator whose error depends on the input.",
      "rights_note": "本 repo 自有檔案。"
    },
    {
      "source_id": "SRC-E007",
      "source_uri": "ledgers/EVIDENCE_LEDGER.md E007 @ a8ca352dc64e792864f351f7775e2b21681b6390",
      "source_type": "repository_file",
      "source_version": "a8ca352dc64e792864f351f7775e2b21681b6390",
      "retrieved_at": "2026-09-16",
      "retrieval_mode": "verbatim",
      "quote": "Corrected gap: 11.4x like-for-like (gpt-5.5 vs deepseek-v4-pro, blended 3:1, cache-miss off-peak). ~100x is reachable only by cherry-picking tiers.",
      "rights_note": "本 repo 自有檔案。"
    },
    {
      "source_id": "SRC-E015",
      "source_uri": "ledgers/EVIDENCE_LEDGER.md E015 @ a8ca352dc64e792864f351f7775e2b21681b6390",
      "source_type": "repository_file",
      "source_version": "a8ca352dc64e792864f351f7775e2b21681b6390",
      "retrieved_at": "2026-09-16",
      "retrieval_mode": "verbatim",
      "quote": "DeepSeek publishes four input prices per model (cache-hit/miss x peak/off-peak); OpenAI prices by context tier; within Anthropic alone the range is 10x.",
      "rights_note": "本 repo 自有檔案。"
    },
    {
      "source_id": "SRC-E003",
      "source_uri": "ledgers/EVIDENCE_LEDGER.md E003 @ a8ca352dc64e792864f351f7775e2b21681b6390",
      "source_type": "repository_file",
      "source_version": "a8ca352dc64e792864f351f7775e2b21681b6390",
      "retrieved_at": "2026-09-16",
      "retrieval_mode": "verbatim",
      "quote": "#2805 repro: 2.1M tokens claimed \"100% saved\" vs ~195 real (>10,000x).",
      "rights_note": "本 repo 自有檔案。"
    },
    {
      "source_id": "SRC-DRYRUN",
      "source_uri": "reports/LAB_001_PILOT_READINESS_REVIEW.md §6-7 @ a8ca352dc64e792864f351f7775e2b21681b6390",
      "source_type": "repository_file",
      "source_version": "a8ca352dc64e792864f351f7775e2b21681b6390",
      "retrieved_at": "2026-09-16",
      "retrieval_mode": "verbatim",
      "quote": "What it establishes about token optimisation: nothing. The token counts come from a pseudo-random number generator seeded on the task id.",
      "rights_note": "本 repo 自有檔案。"
    }
  ],
  "claims": [
    {
      "claim_id": "C-001",
      "statement": "同一套價目表上，15 個費率中有 12 個沒有 cached input 價；缺的是全部 OpenAI 與全部 Anthropic 型號。",
      "evidence_state": "TESTED",
      "source_refs": [
        "SRC-E026"
      ],
      "limitations": [
        "這是 2026-09-15 一天的快照，且只涵蓋該 Lab 選用的型號。",
        "缺價是快照不完整，不代表廠商沒有公開該費率。"
      ],
      "counterevidence": [],
      "authored_by": "AM22",
      "checked_by": "AM36"
    },
    {
      "claim_id": "C-002",
      "statement": "在對抗性校準案例上，只記錄被接受那一次呼叫的計量器把成本低估 65%；把 cached token 以未快取費率計價則高估 5.41 倍。",
      "evidence_state": "TESTED",
      "source_refs": [
        "SRC-CAL"
      ],
      "limitations": [
        "案例是刻意構造的 fixture，不是真實流量分佈；數值證明的是誤差的方向與量級可能很大，不是任一家實際會差這麼多。",
        "計量器與供應商原生 usage 的比對因無憑證而未執行，該環節仍為 FAIL。"
      ],
      "counterevidence": [],
      "authored_by": "AM22",
      "checked_by": "AM36"
    },
    {
      "claim_id": "C-003",
      "statement": "以位元組除以四估算 token，在同一份 fixture 上誤差介於 13.6% 到 61.0%，且會變號；沒有任何校正係數能修好一個誤差隨輸入而變的估算器。",
      "evidence_state": "TESTED",
      "source_refs": [
        "SRC-BYTES4"
      ],
      "limitations": [
        "fixture 的參考計數為合成值，只有結構性結論成立，百分比本身不得外引。"
      ],
      "counterevidence": [],
      "authored_by": "AM22",
      "checked_by": "AM36"
    },
    {
      "claim_id": "C-004",
      "statement": "同一組廠商價目，換一種配對方式會得到 11.4 倍到 257 倍的差距；ATK 自己先前published 的約 100 倍是挑選費率層級的結果。",
      "evidence_state": "OBSERVED",
      "source_refs": [
        "SRC-E007",
        "SRC-E015"
      ],
      "limitations": [
        "僅牌價，未含企業議價與批次層級。",
        "單日快照。"
      ],
      "counterevidence": [],
      "authored_by": "AM22",
      "checked_by": "AM36"
    },
    {
      "claim_id": "C-005",
      "statement": "一個 80,473 星的節省工具，其使用者提出的重現案例顯示節省量被高估逾一萬倍。",
      "evidence_state": "OBSERVED",
      "source_refs": [
        "SRC-E003"
      ],
      "limitations": [
        "14 則 issue 對 80,473 星，是抱怨者偏誤樣本。",
        "「想要準確數字」不等於「願意為可驗證的計量付費」。"
      ],
      "counterevidence": [],
      "authored_by": "AM22",
      "checked_by": "AM36"
    },
    {
      "claim_id": "C-006",
      "statement": "本 repo 目前唯一跑完的十筆紀錄是 dry run，其 token 數來自以 task id 為種子的偽隨機數；該次執行對 token 最佳化不建立任何結論。",
      "evidence_state": "TESTED",
      "source_refs": [
        "SRC-DRYRUN"
      ],
      "limitations": [
        "這是關於我方自有 harness 的測試，與任何候選工具的效果無關。"
      ],
      "counterevidence": [],
      "authored_by": "AM22",
      "checked_by": "AM36"
    }
  ],
  "applicability": {
    "use_when": [
      "要建立每任務成本的計算方式",
      "要評估一個宣稱節省 X% 的工具",
      "要決定成本改善的驗收標準"
    ],
    "not_for": [
      "作為任一廠商目前價格的引用來源——快照為單日牌價",
      "推論任何候選工具實際節省多少——我方零實測"
    ],
    "prerequisites": [
      "知道自己的流量中快取命中的比例"
    ],
    "compatible_versions": [
      "PS-2026-09-15 價目快照"
    ],
    "jurisdiction_if_relevant": null
  },
  "limitations": [
    "本篇全部證據都關於我方自有的計量與環境，沒有任何一項是第三方工具的效果量測。",
    "失敗與重試的成本、人工時間的成本本篇都沒有數字，只有結構性論證。"
  ],
  "unknowns": [
    "我方每一則內容的實際製作成本——尚無工時紀錄。",
    "失敗與重試在真實工作負載中佔總成本的比例——未量測。",
    "計量器與供應商原生 usage 的偏差——因無憑證而 BLOCKED，仍未知。"
  ],
  "rights": {
    "license": "本 repo LICENSE；引用之公開規格片段標明出處",
    "redistribution_allowed": true,
    "commercial_use_allowed": true,
    "attribution_required": true,
    "model_training_allowed": null,
    "notes": null
  },
  "approvals": [
    {
      "role": "author",
      "seat_id": "AM22",
      "decision": "APPROVED",
      "decided_at": "2026-09-16",
      "scope_hash": "sha256:450653b79491cd58733299e502d9c8a1aeb3ec469cb8ae66b146ff9158430720",
      "conditions": null
    },
    {
      "role": "verify",
      "seat_id": "AM36",
      "decision": "NOT_REQUESTED",
      "decided_at": "2026-09-16",
      "scope_hash": "sha256:0000000000000000000000000000000000000000000000000000000000000000",
      "conditions": "本輪為離線樣本，未送 Verify 核定。"
    }
  ],
  "lifecycle": {
    "review_owner": "AM22",
    "supersedes": null,
    "superseded_by": null,
    "revokes": null,
    "revoked_by": null,
    "change_summary": "首版精簡樣本。"
  },
  "machine_counterpart": "atk.token.cost-accounting-floor",
  "human_article_path": "magazine/samples/S002-cost-per-successful-task/article.md",
  "content_hash": "sha256:450653b79491cd58733299e502d9c8a1aeb3ec469cb8ae66b146ff9158430720",
  "disclosure": "由 AI 席位撰寫，未指派人類責任窗口；離線樣本，不是已發布內容。"
}
